{
  "assurance": {
    "predicate_type": "https://github.com/xormania/xorder/assurance/v1",
    "receipt_sha256": "7c43abc198da8afeea9fe9e84b248eae8cd62731c594ab95f7c1a7f0a2b70113",
    "receipt_url": "https://github.com/xormania/xorder/releases/download/python-matrix%2Ftrixie%2Fv1.0.1/assurance.json"
  },
  "build_key": "bac091ac9e7c729c6e180ff82ac9a873030ecf8bb7ee3e42fdd10886b4e3642d",
  "build_key_version": 1,
  "created_at": "2026-10-20T09:12:50.011506Z",
  "definition": {
    "base": {
      "parent": "python-dev/3.14-trixie"
    },
    "capabilities": [
      "native-build",
      "pip",
      "postgresql-client",
      "python",
      "python-matrix",
      "sqlite-readonly-uri",
      "sqlite-wal",
      "tmux",
      "uv",
      "venv"
    ],
    "changes": [
      "Support optional build-time private CA trust for Python downloads through a BuildKit secret and temporary trust store."
    ],
    "companions": [
      "postgres:17-trixie"
    ],
    "execution": {
      "cache_paths": [
        "/home/dev/.cache"
      ],
      "default_gid": 1000,
      "default_uid": 1000,
      "gid_env": "PGID",
      "home": "/home/dev",
      "uid_env": "PUID",
      "workspace": "/workspace"
    },
    "extensions": [],
    "family": "python-matrix",
    "input_fingerprint_version": 2,
    "limitations": [
      "Compatibility with a particular project must include its dependencies, not only requires-python.",
      "Install project dependencies from uv.lock, requirements files, or the project manifest.",
      "Python 3.10 reached upstream end of life on 2026-10-01; it is included for compatibility testing, without upstream security support.",
      "The selected interpreter patches are fixed in images/python-matrix/versions.json and installed during the build; runtime downloads are disabled.",
      "Vendor harness CLIs and credentials are not part of this image."
    ],
    "line": "trixie",
    "line_id": "python-matrix/trixie",
    "migration": "Compatible build fix. Local builds may supply CA_CERTIFICATE without persisting that CA in image layers; existing runtime pins remain valid.",
    "os": "debian-trixie",
    "platforms": [
      "linux/amd64"
    ],
    "purpose": "Python 3.10, 3.12 and 3.14 compatibility testing with tmux and the Python development toolchain.",
    "revision": "1.0.1",
    "runtime_line": "3.14",
    "schema_version": 1,
    "tools": [
      "bash",
      "curl",
      "gh",
      "git",
      "jq",
      "psql",
      "python3.10",
      "python3.12",
      "python3.14",
      "rg",
      "tmux"
    ]
  },
  "input_fingerprint": "08c69a2dddc6c9480a1993bbf9522d726a16fc0232f442ab2a11ed5ea5dcb7bb",
  "lifecycle": "available",
  "line_id": "python-matrix/trixie",
  "platforms": [
    {
      "digest": "sha256:dc0da00ee10740bb20406e4a0544ed4672e6ed0fc82169c34a246ccd20f93662",
      "inventory": {
        "extensions": {},
        "interpreters": {
          "3.10": {
            "executable": "/opt/xorder/python-bin/python3.10",
            "sqlite_version": "3.53.1",
            "version": "3.10.22"
          },
          "3.12": {
            "executable": "/opt/xorder/python-bin/python3.12",
            "sqlite_version": "3.53.1",
            "version": "3.12.15"
          },
          "3.14": {
            "executable": "/opt/xorder/python-bin/python3.14",
            "sqlite_version": "3.53.1",
            "version": "3.14.8"
          }
        },
        "os": {
          "BUG_REPORT_URL": "https://bugs.debian.org/",
          "DEBIAN_VERSION_FULL": "13.7",
          "HOME_URL": "https://www.debian.org/",
          "ID": "debian",
          "NAME": "Debian GNU/Linux",
          "PRETTY_NAME": "Debian GNU/Linux 13 (trixie)",
          "SUPPORT_URL": "https://www.debian.org/support",
          "VERSION": "13 (trixie)",
          "VERSION_CODENAME": "trixie",
          "VERSION_ID": "13"
        },
        "packages": [
          "adduser=3.152",
          "apt=3.0.3",
          "autoconf=2.72-3.1",
          "base-files=13.8+deb13u7",
          "base-passwd=3.6.7",
          "bash=5.2.37-2+b10",
          "binutils=2.44-3",
          "binutils-common=2.44-3",
          "binutils-x86-64-linux-gnu=2.44-3",
          "bsdutils=1:2.41.5-0+deb13u1",
          "build-essential=12.12",
          "bzip2=1.0.8-6",
          "ca-certificates=20250419",
          "coreutils=9.7-3",
          "cpp=4:14.2.0-1",
          "cpp-14=14.2.0-19",
          "cpp-14-x86-64-linux-gnu=14.2.0-19",
          "cpp-x86-64-linux-gnu=4:14.2.0-1",
          "curl=8.14.1-2+deb13u7",
          "dash=0.5.12-12",
          "debconf=1.5.91",
          "debian-archive-keyring=2025.1",
          "debianutils=5.23.2",
          "diffutils=1:3.10-4",
          "dpkg=1.22.22",
          "dpkg-dev=1.22.22",
          "file=1:5.46-5",
          "findutils=4.10.0-3",
          "g++=4:14.2.0-1",
          "g++-14=14.2.0-19",
          "g++-14-x86-64-linux-gnu=14.2.0-19",
          "g++-x86-64-linux-gnu=4:14.2.0-1",
          "gcc=4:14.2.0-1",
          "gcc-14=14.2.0-19",
          "gcc-14-base=14.2.0-19",
          "gcc-14-x86-64-linux-gnu=14.2.0-19",
          "gcc-x86-64-linux-gnu=4:14.2.0-1",
          "gh=2.46.0-3",
          "git=1:2.47.3-0+deb13u1",
          "git-man=1:2.47.3-0+deb13u1",
          "gosu=1.17-3+b4",
          "grep=3.11-4",
          "gzip=1.13-1+deb13u1",
          "hostname=3.25",
          "init-system-helpers=1.69~deb13u1",
          "jq=1.7.1-6+deb13u4",
          "libacl1=2.3.2-2+b1",
          "libapt-pkg7.0=3.0.3",
          "libasan8=14.2.0-19",
          "libatomic1=14.2.0-19",
          "libattr1=1:2.5.2-3",
          "libaudit-common=1:4.0.2-2+deb13u1",
          "libaudit1=1:4.0.2-2+deb13u1",
          "libbinutils=2.44-3",
          "libblkid1=2.41.5-0+deb13u1",
          "libbrotli1=1.1.0-2+b7",
          "libbsd0=0.12.2-2",
          "libbz2-1.0=1.0.8-6",
          "libc-bin=2.41-12+deb13u4",
          "libc-dev-bin=2.41-12+deb13u4",
          "libc6=2.41-12+deb13u4",
          "libc6-dev=2.41-12+deb13u4",
          "libcap-ng0=0.8.5-4+b1",
          "libcap2=1:2.75-10+deb13u1+b3",
          "libcc1-0=14.2.0-19",
          "libcom-err2=1.47.2-3+b12",
          "libcrypt-dev=1:4.4.38-1",
          "libcrypt1=1:4.4.38-1",
          "libctf-nobfd0=2.44-3",
          "libctf0=2.44-3",
          "libcurl3t64-gnutls=8.14.1-2+deb13u7",
          "libcurl4t64=8.14.1-2+deb13u7",
          "libdb5.3t64=5.3.28+dfsg2-9",
          "libdebconfclient0=0.280",
          "libdpkg-perl=1.22.22",
          "liberror-perl=0.17030-1",
          "libevent-core-2.1-7t64=2.1.13-stable-1~deb13u1",
          "libexpat1=2.9.0-1~deb13u1",
          "libffi8=3.4.8-2",
          "libgcc-14-dev=14.2.0-19",
          "libgcc-s1=14.2.0-19",
          "libgdbm-compat4t64=1.24-2",
          "libgdbm6t64=1.24-2",
          "libgmp10=2:6.3.0+dfsg-3",
          "libgnutls30t64=3.8.9-3+deb13u4",
          "libgomp1=14.2.0-19",
          "libgprofng0=2.44-3",
          "libgssapi-krb5-2=1.21.3-5+deb13u1",
          "libhogweed6t64=3.10.1-1",
          "libhwasan0=14.2.0-19",
          "libidn2-0=2.3.8-2",
          "libisl23=0.27-1",
          "libitm1=14.2.0-19",
          "libjansson4=2.14-2+b3",
          "libjemalloc2=5.3.0-3",
          "libjq1=1.7.1-6+deb13u4",
          "libk5crypto3=1.21.3-5+deb13u1",
          "libkeyutils1=1.6.3-6",
          "libkrb5-3=1.21.3-5+deb13u1",
          "libkrb5support0=1.21.3-5+deb13u1",
          "liblastlog2-2=2.41.5-0+deb13u1",
          "libldap2=2.6.10+dfsg-1",
          "liblsan0=14.2.0-19",
          "liblz4-1=1.10.0-4",
          "liblzma5=5.8.1-1+deb13u2",
          "libmagic-mgc=1:5.46-5",
          "libmagic1t64=1:5.46-5",
          "libmd0=1.1.0-2+b1",
          "libmount1=2.41.5-0+deb13u1",
          "libmpc3=1.3.1-1+b3",
          "libmpfr6=4.2.2-1",
          "libncursesw6=6.5+20250216-2",
          "libnettle8t64=3.10.1-1",
          "libnghttp2-14=1.64.0-1.1+deb13u1",
          "libnghttp3-9=1.8.0-1",
          "libngtcp2-16=1.11.0-1+deb13u1",
          "libngtcp2-crypto-gnutls8=1.11.0-1+deb13u1",
          "libonig5=6.9.9-1+b1",
          "libp11-kit0=0.25.5-3",
          "libpam-modules=1.7.0-5",
          "libpam-modules-bin=1.7.0-5",
          "libpam-runtime=1.7.0-5",
          "libpam0g=1.7.0-5",
          "libpcre2-8-0=10.46-1~deb13u3",
          "libperl5.40=5.40.1-6+deb13u1",
          "libpkgconf3=1.8.1-4",
          "libpq-dev=17.11-0+deb13u1",
          "libpq5=17.11-0+deb13u1",
          "libproc2-0=2:4.0.4-9",
          "libpsl5t64=0.21.2-1.1+b1",
          "libquadmath0=14.2.0-19",
          "libreadline8t64=8.2-6",
          "librtmp1=2.4+20151223.gitfa8646d.1-2+b5",
          "libsasl2-2=2.1.28+dfsg1-9",
          "libsasl2-modules-db=2.1.28+dfsg1-9",
          "libseccomp2=2.6.0-2",
          "libselinux1=3.8.1-1",
          "libsemanage-common=3.8.1-1",
          "libsemanage2=3.8.1-1",
          "libsepol2=3.8.1-1",
          "libsframe1=2.44-3",
          "libsmartcols1=2.41.5-0+deb13u1",
          "libsqlite3-0=3.46.1-7+deb13u2",
          "libssh2-1t64=1.11.1-1+deb13u2",
          "libssl-dev=3.5.7-1~deb13u3",
          "libssl3t64=3.5.7-1~deb13u3",
          "libstdc++-14-dev=14.2.0-19",
          "libstdc++6=14.2.0-19",
          "libsystemd0=257.13-1~deb13u1",
          "libtasn1-6=4.20.0-2+deb13u1",
          "libtinfo6=6.5+20250216-2",
          "libtsan2=14.2.0-19",
          "libubsan1=14.2.0-19",
          "libudev1=257.13-1~deb13u1",
          "libunistring5=1.3-2",
          "libuuid1=2.41.5-0+deb13u1",
          "libxxhash0=0.8.3-2",
          "libzstd1=1.5.7+dfsg-1",
          "linux-libc-dev=6.12.113-1",
          "login=1:4.16.0-2+really2.41.5-0+deb13u1",
          "login.defs=1:4.17.4-2",
          "m4=1.4.19-8",
          "make=4.4.1-2",
          "mawk=1.3.4.20250131-1",
          "mount=2.41.5-0+deb13u1",
          "ncurses-base=6.5+20250216-2",
          "ncurses-bin=6.5+20250216-2",
          "netbase=6.5",